"No.","Time","Source","Destination","Protocol","Length","Info"
"1","0.000000","172.16.4.1","172.16.4.193","DHCP","348","DHCP ACK      - Transaction ID 0x39132272"
"2","0.008974","172.16.4.193","224.0.0.252","LLMNR","69","Standard query 0xf14f ANY Stewie-PC"
"3","0.107795","172.16.4.193","224.0.0.252","LLMNR","69","Standard query 0xf14f ANY Stewie-PC"
"4","1.528070","172.16.4.193","224.0.0.252","LLMNR","66","Standard query 0x8280 A isatap"
"5","1.636618","172.16.4.193","224.0.0.252","LLMNR","66","Standard query 0x8280 A isatap"
"6","2.060191","172.16.4.193","172.16.4.255","NBNS","110","Release NB STEWIE-PC<20>"
"7","2.060388","172.16.4.193","172.16.4.255","NBNS","110","Release NB WORKGROUP<00>"
"8","2.060396","172.16.4.193","172.16.4.255","NBNS","110","Release NB STEWIE-PC<00>"
"9","2.136179","172.16.4.193","172.16.4.255","NBNS","110","Registration NB STEWIE-PC<00>"
"10","2.136377","172.16.4.193","172.16.4.255","NBNS","110","Registration NB WORKGROUP<00>"
"11","2.136383","172.16.4.193","172.16.4.255","NBNS","110","Registration NB STEWIE-PC<20>"
"12","2.603784","172.16.4.193","172.16.4.255","NBNS","92","Name query NB ISATAP<00>"
"13","2.900156","172.16.4.193","172.16.4.255","NBNS","110","Registration NB STEWIE-PC<20>"
"14","2.900175","172.16.4.193","172.16.4.255","NBNS","110","Registration NB WORKGROUP<00>"
"15","2.900180","172.16.4.193","172.16.4.255","NBNS","110","Registration NB STEWIE-PC<00>"
"16","3.060350","172.16.4.193","172.16.4.1","DNS","85","Standard query 0xeb7f A teredo.ipv6.microsoft.com"
"17","3.250308","172.16.4.1","172.16.4.193","DNS","187","Standard query response 0xeb7f No such name A teredo.ipv6.microsoft.com CNAME teredo.ipv6.microsoft.com.nsatc.net SOA admin.nsatc.net"
"18","3.368166","172.16.4.193","172.16.4.255","NBNS","92","Name query NB ISATAP<00>"
"19","3.419891","172.16.4.193","255.255.255.255","DHCP","342","DHCP Inform   - Transaction ID 0x374973ec"
"20","3.419917","172.16.4.193","224.0.0.252","LLMNR","69","Standard query 0xf553 ANY Stewie-PC"
"21","3.420105","172.16.4.1","172.16.4.193","DHCP","342","DHCP ACK      - Transaction ID 0x374973ec"
"22","3.423435","172.16.4.193","224.0.0.252","LLMNR","64","Standard query 0x41b6 A wpad"
"23","3.524231","172.16.4.193","224.0.0.252","LLMNR","64","Standard query 0x41b6 A wpad"
"24","3.524418","172.16.4.193","224.0.0.252","LLMNR","69","Standard query 0xf553 ANY Stewie-PC"
"25","3.664572","172.16.4.193","172.16.4.255","NBNS","110","Registration NB STEWIE-PC<00>"
"26","3.664591","172.16.4.193","172.16.4.255","NBNS","110","Registration NB WORKGROUP<00>"
"27","3.664596","172.16.4.193","172.16.4.255","NBNS","110","Registration NB STEWIE-PC<20>"
"28","3.727235","172.16.4.193","172.16.4.255","NBNS","92","Name query NB WPAD<00>"
"29","4.133497","172.16.4.193","224.0.0.252","LLMNR","66","Standard query 0xf4fd A isatap"
"30","4.241846","172.16.4.193","224.0.0.252","LLMNR","66","Standard query 0xf4fd A isatap"
"31","4.429000","172.16.4.193","172.16.4.255","NBNS","110","Registration NB STEWIE-PC<20>"
"32","4.429021","172.16.4.193","172.16.4.255","NBNS","110","Registration NB WORKGROUP<00>"
"33","4.429026","172.16.4.193","172.16.4.255","NBNS","110","Registration NB STEWIE-PC<00>"
"34","4.444825","172.16.4.193","172.16.4.255","NBNS","92","Name query NB ISATAP<00>"
"35","4.491408","172.16.4.193","172.16.4.255","NBNS","92","Name query NB WPAD<00>"
"36","5.208997","172.16.4.193","172.16.4.255","NBNS","92","Name query NB ISATAP<00>"
"37","5.255772","172.16.4.193","172.16.4.255","NBNS","92","Name query NB WPAD<00>"
"38","5.973434","172.16.4.193","172.16.4.255","NBNS","92","Name query NB ISATAP<00>"
"39","6.023250","172.16.4.193","172.16.4.1","DNS","76","Standard query 0x6f69 A www.msftncsi.com"
"40","6.126382","172.16.4.1","172.16.4.193","DNS","182","Standard query response 0x6f69 A www.msftncsi.com CNAME www.msftncsi.com.edgesuite.net CNAME a1961.g2.akamai.net A 66.152.103.72 A 66.152.103.74"
"41","6.128969","172.16.4.193","66.152.103.72","TCP","66","49157  >  80 [SYN] Seq=0 Win=8192 Len=0 MSS=1460 WS=256 SACK_PERM"
"42","6.200574","66.152.103.72","172.16.4.193","TCP","66","80  >  49157 [SYN, ACK] Seq=0 Ack=1 Win=29200 Len=0 MSS=1321 SACK_PERM WS=32"
"43","6.200731","172.16.4.193","66.152.103.72","TCP","60","49157  >  80 [ACK] Seq=1 Ack=1 Win=66048 Len=0"
"44","6.200977","172.16.4.193","66.152.103.72","HTTP","151","GET /ncsi.txt HTTP/1.1 "
"45","6.281882","66.152.103.72","172.16.4.193","TCP","54","80  >  49157 [ACK] Seq=1 Ack=98 Win=29216 Len=0"
"46","6.282080","66.152.103.72","172.16.4.193","HTTP","233","HTTP/1.1 200 OK  (text/plain)"
"47","6.282105","66.152.103.72","172.16.4.193","TCP","54","80  >  49157 [FIN, ACK] Seq=180 Ack=98 Win=29216 Len=0"
"48","6.282230","172.16.4.193","66.152.103.72","TCP","60","49157  >  80 [ACK] Seq=98 Ack=181 Win=65792 Len=0"
"49","6.282269","172.16.4.193","66.152.103.72","TCP","60","49157  >  80 [FIN, ACK] Seq=98 Ack=181 Win=65792 Len=0"
"50","6.353842","66.152.103.72","172.16.4.193","TCP","54","80  >  49157 [ACK] Seq=181 Ack=99 Win=29216 Len=0"
"51","6.738459","172.16.4.193","224.0.0.252","LLMNR","66","Standard query 0x90bb A isatap"
"52","6.829154","172.16.4.193","172.16.4.1","DNS","85","Standard query 0x3c54 A teredo.ipv6.microsoft.com"
"53","6.829250","172.16.4.1","172.16.4.193","DNS","134","Standard query response 0x3c54 No such name A teredo.ipv6.microsoft.com CNAME teredo.ipv6.microsoft.com.nsatc.net"
"54","6.847063","172.16.4.193","224.0.0.252","LLMNR","66","Standard query 0x90bb A isatap"
"55","7.050059","172.16.4.193","172.16.4.255","NBNS","92","Name query NB ISATAP<00>"
"56","7.814269","172.16.4.193","172.16.4.255","NBNS","92","Name query NB ISATAP<00>"
"57","8.578668","172.16.4.193","172.16.4.255","NBNS","92","Name query NB ISATAP<00>"
"58","9.343744","172.16.4.193","224.0.0.252","LLMNR","66","Standard query 0x3f8a A isatap"
"59","9.452326","172.16.4.193","224.0.0.252","LLMNR","66","Standard query 0x3f8a A isatap"
"60","9.655243","172.16.4.193","172.16.4.255","NBNS","92","Name query NB ISATAP<00>"
"61","10.419494","172.16.4.193","172.16.4.255","NBNS","92","Name query NB ISATAP<00>"
"62","11.183905","172.16.4.193","172.16.4.255","NBNS","92","Name query NB ISATAP<00>"
"63","11.948999","172.16.4.193","224.0.0.252","LLMNR","66","Standard query 0x5b88 A isatap"
"64","12.057561","172.16.4.193","224.0.0.252","LLMNR","66","Standard query 0x5b88 A isatap"
"65","12.260482","172.16.4.193","172.16.4.255","NBNS","92","Name query NB ISATAP<00>"
"66","13.024730","172.16.4.193","172.16.4.255","NBNS","92","Name query NB ISATAP<00>"
"67","13.789137","172.16.4.193","172.16.4.255","NBNS","92","Name query NB ISATAP<00>"
"68","14.554535","172.16.4.193","224.0.0.252","LLMNR","66","Standard query 0x0eea A isatap"
"69","14.662794","172.16.4.193","224.0.0.252","LLMNR","66","Standard query 0x0eea A isatap"
"70","14.865726","172.16.4.193","172.16.4.255","NBNS","92","Name query NB ISATAP<00>"
"71","15.629968","172.16.4.193","172.16.4.255","NBNS","92","Name query NB ISATAP<00>"
"72","16.394380","172.16.4.193","172.16.4.255","NBNS","92","Name query NB ISATAP<00>"
"73","17.159483","172.16.4.193","224.0.0.252","LLMNR","66","Standard query 0x69fe A isatap"
"74","17.268032","172.16.4.193","224.0.0.252","LLMNR","66","Standard query 0x69fe A isatap"
"75","17.470978","172.16.4.193","172.16.4.255","NBNS","92","Name query NB ISATAP<00>"
"76","18.235202","172.16.4.193","172.16.4.255","NBNS","92","Name query NB ISATAP<00>"
"77","18.999613","172.16.4.193","172.16.4.255","NBNS","92","Name query NB ISATAP<00>"
"78","19.764526","172.16.4.193","224.0.0.252","LLMNR","66","Standard query 0x748e A isatap"
"79","19.873256","172.16.4.193","224.0.0.252","LLMNR","66","Standard query 0x748e A isatap"
"80","20.076431","172.16.4.193","172.16.4.255","NBNS","92","Name query NB ISATAP<00>"
"81","20.840402","172.16.4.193","172.16.4.255","NBNS","92","Name query NB ISATAP<00>"
"82","21.604845","172.16.4.193","172.16.4.255","NBNS","92","Name query NB ISATAP<00>"
"83","22.369890","172.16.4.193","224.0.0.252","LLMNR","66","Standard query 0xb2c5 A isatap"
"84","22.478645","172.16.4.193","224.0.0.252","LLMNR","66","Standard query 0xb2c5 A isatap"
"85","22.681453","172.16.4.193","172.16.4.255","NBNS","92","Name query NB ISATAP<00>"
"86","23.445635","172.16.4.193","172.16.4.255","NBNS","92","Name query NB ISATAP<00>"
"87","24.210080","172.16.4.193","172.16.4.255","NBNS","92","Name query NB ISATAP<00>"
"88","24.975179","172.16.4.193","224.0.0.252","LLMNR","66","Standard query 0xb4d3 A isatap"
"89","25.083707","172.16.4.193","224.0.0.252","LLMNR","66","Standard query 0xb4d3 A isatap"
"90","25.286686","172.16.4.193","172.16.4.255","NBNS","92","Name query NB ISATAP<00>"
"91","26.050911","172.16.4.193","172.16.4.255","NBNS","92","Name query NB ISATAP<00>"
"92","26.815284","172.16.4.193","172.16.4.255","NBNS","92","Name query NB ISATAP<00>"
"93","27.580332","172.16.4.193","224.0.0.252","LLMNR","66","Standard query 0x7b80 A isatap"
"94","27.688955","172.16.4.193","224.0.0.252","LLMNR","66","Standard query 0x7b80 A isatap"
"95","27.891930","172.16.4.193","172.16.4.255","NBNS","92","Name query NB ISATAP<00>"
"96","28.656143","172.16.4.193","172.16.4.255","NBNS","92","Name query NB ISATAP<00>"
"97","29.420549","172.16.4.193","172.16.4.255","NBNS","92","Name query NB ISATAP<00>"
"98","44.168155","172.16.4.193","172.16.4.1","DNS","72","Standard query 0xacdf A www.bing.com"
"99","44.248037","172.16.4.1","172.16.4.193","DNS","164","Standard query response 0xacdf A www.bing.com CNAME www-bing-com.a-0001.a-msedge.net CNAME a-0001.a-msedge.net A 204.79.197.200 A 13.107.21.200"
"100","44.647184","172.16.4.193","224.0.0.252","LLMNR","64","Standard query 0xe13b A wpad"
"101","44.694041","172.16.4.193","204.79.197.200","TCP","66","49158  >  80 [SYN] Seq=0 Win=8192 Len=0 MSS=1460 WS=256 SACK_PERM"
"102","44.694091","172.16.4.193","204.79.197.200","TCP","66","49159  >  80 [SYN] Seq=0 Win=8192 Len=0 MSS=1460 WS=256 SACK_PERM"
"103","44.755629","172.16.4.193","224.0.0.252","LLMNR","64","Standard query 0xe13b A wpad"
"104","44.958615","172.16.4.193","172.16.4.255","NBNS","92","Name query NB WPAD<00>"
"105","45.218410","204.79.197.200","172.16.4.193","TCP","66","80  >  49159 [SYN, ACK] Seq=0 Ack=1 Win=8192 Len=0 MSS=1321 WS=256 SACK_PERM"
"106","45.218574","172.16.4.193","204.79.197.200","TCP","60","49159  >  80 [ACK] Seq=1 Ack=1 Win=66048 Len=0"
"107","45.218819","172.16.4.193","204.79.197.200","HTTP","550","GET / HTTP/1.1 "
"108","45.219218","204.79.197.200","172.16.4.193","TCP","66","80  >  49158 [SYN, ACK] Seq=0 Ack=1 Win=8192 Len=0 MSS=1321 WS=256 SACK_PERM"
"109","45.219360","172.16.4.193","204.79.197.200","TCP","60","49158  >  80 [ACK] Seq=1 Ack=1 Win=66048 Len=0"
"110","45.297602","204.79.197.200","172.16.4.193","TCP","54","80  >  49159 [ACK] Seq=1 Ack=497 Win=132096 Len=0"
"111","45.352517","204.79.197.200","172.16.4.193","TCP","1375","80  >  49159 [ACK] Seq=1 Ack=497 Win=132096 Len=1321 [TCP PDU reassembled in 165]"
"112","45.352563","204.79.197.200","172.16.4.193","TCP","623","80  >  49159 [PSH, ACK] Seq=1322 Ack=497 Win=132096 Len=569 [TCP PDU reassembled in 165]"
"113","45.352594","204.79.197.200","172.16.4.193","TCP","1375","80  >  49159 [ACK] Seq=1891 Ack=497 Win=132096 Len=1321 [TCP PDU reassembled in 165]"
"114","45.352698","204.79.197.200","172.16.4.193","TCP","1375","80  >  49159 [ACK] Seq=3212 Ack=497 Win=132096 Len=1321 [TCP PDU reassembled in 165]"
"115","45.352754","172.16.4.193","204.79.197.200","TCP","60","49159  >  80 [ACK] Seq=497 Ack=1322 Win=66048 Len=0"
"116","45.352790","172.16.4.193","204.79.197.200","TCP","60","49159  >  80 [ACK] Seq=497 Ack=1891 Win=65280 Len=0"
"117","45.352931","204.79.197.200","172.16.4.193","TCP","1375","80  >  49159 [ACK] Seq=4533 Ack=497 Win=132096 Len=1321 [TCP PDU reassembled in 165]"
"118","45.353000","172.16.4.193","204.79.197.200","TCP","60","49159  >  80 [ACK] Seq=497 Ack=3212 Win=66048 Len=0"
"119","45.353010","172.16.4.193","204.79.197.200","TCP","60","49159  >  80 [ACK] Seq=497 Ack=4533 Win=66048 Len=0"
"120","45.353030","204.79.197.200","172.16.4.193","TCP","1375","80  >  49159 [ACK] Seq=5854 Ack=497 Win=132096 Len=1321 [TCP PDU reassembled in 165]"
"121","45.353161","204.79.197.200","172.16.4.193","TCP","1375","80  >  49159 [ACK] Seq=7175 Ack=497 Win=132096 Len=1321 [TCP PDU reassembled in 165]"
"122","45.353250","172.16.4.193","204.79.197.200","TCP","60","49159  >  80 [ACK] Seq=497 Ack=5854 Win=66048 Len=0"
"123","45.353258","172.16.4.193","204.79.197.200","TCP","60","49159  >  80 [ACK] Seq=497 Ack=7175 Win=66048 Len=0"
"124","45.353276","204.79.197.200","172.16.4.193","TCP","1375","80  >  49159 [ACK] Seq=8496 Ack=497 Win=132096 Len=1321 [TCP PDU reassembled in 165]"
"125","45.353302","204.79.197.200","172.16.4.193","TCP","320","80  >  49159 [PSH, ACK] Seq=9817 Ack=497 Win=132096 Len=266 [TCP PDU reassembled in 165]"
"126","45.353423","204.79.197.200","172.16.4.193","TCP","1375","80  >  49159 [ACK] Seq=10083 Ack=497 Win=132096 Len=1321 [TCP PDU reassembled in 165]"
"127","45.353499","172.16.4.193","204.79.197.200","TCP","60","49159  >  80 [ACK] Seq=497 Ack=8496 Win=66048 Len=0"
"128","45.353507","172.16.4.193","204.79.197.200","TCP","60","49159  >  80 [ACK] Seq=497 Ack=9817 Win=66048 Len=0"
"129","45.353514","172.16.4.193","204.79.197.200","TCP","60","49159  >  80 [ACK] Seq=497 Ack=10083 Win=65536 Len=0"
"130","45.353530","204.79.197.200","172.16.4.193","TCP","1375","80  >  49159 [ACK] Seq=11404 Ack=497 Win=132096 Len=1321 [TCP PDU reassembled in 165]"
"131","45.353668","204.79.197.200","172.16.4.193","TCP","1375","80  >  49159 [ACK] Seq=12725 Ack=497 Win=132096 Len=1321 [TCP PDU reassembled in 165]"
"132","45.353749","172.16.4.193","204.79.197.200","TCP","60","49159  >  80 [ACK] Seq=497 Ack=11404 Win=64256 Len=0"
"133","45.353757","172.16.4.193","204.79.197.200","TCP","60","49159  >  80 [ACK] Seq=497 Ack=12725 Win=62976 Len=0"
"134","45.353776","204.79.197.200","172.16.4.193","TCP","1375","80  >  49159 [ACK] Seq=14046 Ack=497 Win=132096 Len=1321 [TCP PDU reassembled in 165]"
"135","45.353897","204.79.197.200","172.16.4.193","TCP","1375","80  >  49159 [ACK] Seq=15367 Ack=497 Win=132096 Len=1321 [TCP PDU reassembled in 165]"
"136","45.353999","172.16.4.193","204.79.197.200","TCP","60","49159  >  80 [ACK] Seq=497 Ack=14046 Win=61696 Len=0"
"137","45.354007","172.16.4.193","204.79.197.200","TCP","60","49159  >  80 [ACK] Seq=497 Ack=15367 Win=60416 Len=0"
"138","45.354025","204.79.197.200","172.16.4.193","TCP","1375","80  >  49159 [ACK] Seq=16688 Ack=497 Win=132096 Len=1321 [TCP PDU reassembled in 165]"
"139","45.354050","204.79.197.200","172.16.4.193","TCP","320","80  >  49159 [PSH, ACK] Seq=18009 Ack=497 Win=132096 Len=266 [TCP PDU reassembled in 165]"
"140","45.354177","204.79.197.200","172.16.4.193","TCP","1375","80  >  49159 [ACK] Seq=18275 Ack=497 Win=132096 Len=1321 [TCP PDU reassembled in 165]"
"141","45.354250","172.16.4.193","204.79.197.200","TCP","60","49159  >  80 [ACK] Seq=497 Ack=16688 Win=59136 Len=0"
"142","45.354259","172.16.4.193","204.79.197.200","TCP","60","49159  >  80 [ACK] Seq=497 Ack=18009 Win=57856 Len=0"
"143","45.354265","172.16.4.193","204.79.197.200","TCP","60","49159  >  80 [ACK] Seq=497 Ack=18275 Win=57344 Len=0"
"144","45.354284","204.79.197.200","172.16.4.193","TCP","1375","80  >  49159 [ACK] Seq=19596 Ack=497 Win=132096 Len=1321 [TCP PDU reassembled in 165]"
"145","45.354499","172.16.4.193","204.79.197.200","TCP","60","49159  >  80 [ACK] Seq=497 Ack=19596 Win=56064 Len=0"
"146","45.354511","172.16.4.193","204.79.197.200","TCP","60","49159  >  80 [ACK] Seq=497 Ack=20917 Win=54784 Len=0"
"147","45.358893","172.16.4.193","204.79.197.200","TCP","60","[TCP Window Update] 49159  >  80 [ACK] Seq=497 Ack=20917 Win=66048 Len=0"
"148","45.423695","204.79.197.200","172.16.4.193","TCP","1375","80  >  49159 [ACK] Seq=20917 Ack=497 Win=132096 Len=1321 [TCP PDU reassembled in 165]"
"149","45.423735","204.79.197.200","172.16.4.193","TCP","1375","80  >  49159 [ACK] Seq=22238 Ack=497 Win=132096 Len=1321 [TCP PDU reassembled in 165]"
"150","45.423921","204.79.197.200","172.16.4.193","TCP","1375","80  >  49159 [ACK] Seq=23559 Ack=497 Win=132096 Len=1321 [TCP PDU reassembled in 165]"
"151","45.423955","172.16.4.193","204.79.197.200","TCP","60","49159  >  80 [ACK] Seq=497 Ack=22238 Win=66048 Len=0"
"152","45.423992","172.16.4.193","204.79.197.200","TCP","60","49159  >  80 [ACK] Seq=497 Ack=23559 Win=66048 Len=0"
"153","45.424067","204.79.197.200","172.16.4.193","TCP","1375","80  >  49159 [ACK] Seq=24880 Ack=497 Win=132096 Len=1321 [TCP PDU reassembled in 165]"
"154","45.424146","204.79.197.200","172.16.4.193","TCP","1375","80  >  49159 [PSH, ACK] Seq=26201 Ack=497 Win=132096 Len=1321 [TCP PDU reassembled in 165]"
"155","45.424201","172.16.4.193","204.79.197.200","TCP","60","49159  >  80 [ACK] Seq=497 Ack=24880 Win=66048 Len=0"
"156","45.424451","172.16.4.193","204.79.197.200","TCP","60","49159  >  80 [ACK] Seq=497 Ack=26201 Win=66048 Len=0"
"157","45.424462","172.16.4.193","204.79.197.200","TCP","60","49159  >  80 [ACK] Seq=497 Ack=27522 Win=66048 Len=0"
"158","45.434746","204.79.197.200","172.16.4.193","TCP","1375","80  >  49159 [PSH, ACK] Seq=27522 Ack=497 Win=132096 Len=1321 [TCP PDU reassembled in 165]"
"159","45.434961","172.16.4.193","204.79.197.200","TCP","60","49159  >  80 [ACK] Seq=497 Ack=28843 Win=66048 Len=0"
"160","45.434965","204.79.197.200","172.16.4.193","TCP","1375","80  >  49159 [ACK] Seq=28843 Ack=497 Win=132096 Len=1321 [TCP PDU reassembled in 165]"
"161","45.435110","204.79.197.200","172.16.4.193","TCP","1375","80  >  49159 [ACK] Seq=30164 Ack=497 Win=132096 Len=1321 [TCP PDU reassembled in 165]"
"162","45.435207","172.16.4.193","204.79.197.200","TCP","60","49159  >  80 [ACK] Seq=497 Ack=30164 Win=66048 Len=0"
"163","45.435212","204.79.197.200","172.16.4.193","TCP","1375","80  >  49159 [ACK] Seq=31485 Ack=497 Win=132096 Len=1321 [TCP PDU reassembled in 165]"
"164","45.435324","204.79.197.200","172.16.4.193","TCP","1375","80  >  49159 [ACK] Seq=32806 Ack=497 Win=132096 Len=1321 [TCP PDU reassembled in 165]"
"165","45.435434","204.79.197.200","172.16.4.193","HTTP","1246","HTTP/1.1 200 OK  (text/html)"
"166","45.435459","172.16.4.193","204.79.197.200","TCP","60","49159  >  80 [ACK] Seq=497 Ack=31485 Win=66048 Len=0"
"167","45.435473","172.16.4.193","204.79.197.200","TCP","60","49159  >  80 [ACK] Seq=497 Ack=32806 Win=66048 Len=0"
"168","45.435707","172.16.4.193","204.79.197.200","TCP","60","49159  >  80 [ACK] Seq=497 Ack=34127 Win=66048 Len=0"
"169","45.435718","172.16.4.193","204.79.197.200","TCP","60","49159  >  80 [ACK] Seq=497 Ack=35319 Win=64768 Len=0"
"170","45.562039","172.16.4.193","204.79.197.200","HTTP","695","GET /s/a/hpc18.png HTTP/1.1 "
"171","45.634545","204.79.197.200","172.16.4.193","TCP","54","80  >  49158 [ACK] Seq=1 Ack=642 Win=132096 Len=0"
"172","45.634902","204.79.197.200","172.16.4.193","TCP","1375","80  >  49158 [ACK] Seq=1 Ack=642 Win=132096 Len=1321 [TCP PDU reassembled in 179]"
"173","45.635157","172.16.4.193","204.79.197.200","TCP","60","49158  >  80 [ACK] Seq=642 Ack=1322 Win=66048 Len=0"
"174","45.635210","204.79.197.200","172.16.4.193","TCP","1375","80  >  49158 [ACK] Seq=1322 Ack=642 Win=132096 Len=1321 [TCP PDU reassembled in 179]"
"175","45.635324","204.79.197.200","172.16.4.193","TCP","1375","80  >  49158 [ACK] Seq=2643 Ack=642 Win=132096 Len=1321 [TCP PDU reassembled in 179]"
"176","45.635402","172.16.4.193","204.79.197.200","TCP","60","49158  >  80 [ACK] Seq=642 Ack=2643 Win=66048 Len=0"
"177","45.635439","204.79.197.200","172.16.4.193","TCP","1375","80  >  49158 [ACK] Seq=3964 Ack=642 Win=132096 Len=1321 [TCP PDU reassembled in 179]"
"178","45.635561","204.79.197.200","172.16.4.193","TCP","1375","80  >  49158 [ACK] Seq=5285 Ack=642 Win=132096 Len=1321 [TCP PDU reassembled in 179]"
"179","45.635589","204.79.197.200","172.16.4.193","HTTP","349","HTTP/1.1 200 OK  (PNG)"
"180","45.635652","172.16.4.193","204.79.197.200","TCP","60","49158  >  80 [ACK] Seq=642 Ack=3964 Win=66048 Len=0"
"181","45.635668","172.16.4.193","204.79.197.200","TCP","60","49158  >  80 [ACK] Seq=642 Ack=5285 Win=66048 Len=0"
"182","45.635902","172.16.4.193","204.79.197.200","TCP","60","49158  >  80 [ACK] Seq=642 Ack=6606 Win=66048 Len=0"
"183","45.635914","172.16.4.193","204.79.197.200","TCP","60","49158  >  80 [ACK] Seq=642 Ack=6901 Win=65536 Len=0"
"184","45.662372","172.16.4.193","204.79.197.200","HTTP","598","GET /fd/s/a/hp/bing.svg HTTP/1.1 "
"185","45.690347","172.16.4.193","204.79.197.200","HTTP","880","GET /fd/ls/l?IG=194EC908DA65455B9E9A98285A33132B&Type=Event.CPT&DATA={""pp"":{""S"":""L"",""FC"":-1,""BC"":-1,""SE"":-1,""TC"":-1,""H"":125,""BP"":187,""CT"":209,""IL"":3},""ad"":[-1,-1,878,551,878,551,1]}&P=SERP&DA=BN1&MN=SERP HTTP/1.1 "
"186","45.693536","172.16.4.193","204.79.197.200","TCP","66","49160  >  80 [SYN] Seq=0 Win=8192 Len=0 MSS=1460 WS=256 SACK_PERM"
"187","45.694757","172.16.4.193","204.79.197.200","TCP","66","49161  >  80 [SYN] Seq=0 Win=8192 Len=0 MSS=1460 WS=256 SACK_PERM"
"188","45.709673","172.16.4.193","172.16.4.255","NBNS","92","Name query NB WPAD<00>"
"189","45.739843","204.79.197.200","172.16.4.193","TCP","54","80  >  49158 [ACK] Seq=6901 Ack=1186 Win=131328 Len=0"
"190","45.740584","204.79.197.200","172.16.4.193","TCP","1375","80  >  49158 [ACK] Seq=6901 Ack=1186 Win=131328 Len=1321 [TCP PDU reassembled in 297]"
"191","45.740834","172.16.4.193","204.79.197.200","TCP","60","49158  >  80 [ACK] Seq=1186 Ack=8222 Win=66048 Len=0"
"192","45.764061","204.79.197.200","172.16.4.193","TCP","54","80  >  49159 [ACK] Seq=35319 Ack=1323 Win=131072 Len=0"
"193","45.767861","204.79.197.200","172.16.4.193","HTTP","272","HTTP/1.1 204 OK "
"194","45.768014","172.16.4.193","204.79.197.200","TCP","60","49159  >  80 [ACK] Seq=1323 Ack=35537 Win=66048 Len=0"
"195","45.768258","172.16.4.193","204.79.197.200","TCP","721","49159  >  80 [PSH, ACK] Seq=1323 Ack=35537 Win=66048 Len=667 [TCP PDU reassembled in 196]"
"196","45.768507","172.16.4.193","204.79.197.200","HTTP/XML","391","POST /fd/ls/lsp.aspx? HTTP/1.1 "
"197","45.773043","204.79.197.200","172.16.4.193","TCP","66","80  >  49161 [SYN, ACK] Seq=0 Ack=1 Win=8192 Len=0 MSS=1321 WS=256 SACK_PERM"
"198","45.773073","204.79.197.200","172.16.4.193","TCP","66","80  >  49160 [SYN, ACK] Seq=0 Ack=1 Win=8192 Len=0 MSS=1321 WS=256 SACK_PERM"
"199","45.773191","172.16.4.193","204.79.197.200","TCP","60","49161  >  80 [ACK] Seq=1 Ack=1 Win=66048 Len=0"
"200","45.773436","172.16.4.193","204.79.197.200","TCP","60","49160  >  80 [ACK] Seq=1 Ack=1 Win=66048 Len=0"
"201","45.773449","172.16.4.193","204.79.197.200","HTTP","1272","GET /rms/BingCore.Bundle/jc,nj/5353b0f3/0774d476.js?bu=rms+answers+Shared+BingCore%24ClientInstV2%24DuplicateXlsDefaultConfig%2cBingCore%24ClientInstV2%24SharedLocalStorageConfigDefault%2cBingCore%24shared%2cBingCore%24env.override%2cEmpty%2cBingCore%24event.custom.fix%2cBingCore%24event.native%2cBingCore%24onHTML%2cBingCore%24dom%2cBingCore%24cookies%2cBingCore%24rmsajax%2cBingCore%24ClientInstV2%24LogUploadCapFeatureDisabled%2cBingCore%24ClientInstV2%24ClientInstConfigSeparateOfflineQueue%2cBingCore%24clientinst%2cBingCore%24replay%2cBingCore%24Animation%2cBingCore%24fadeAnimation%2cBingCore%24framework HTTP/1.1 "
"202","45.847963","204.79.197.200","172.16.4.193","TCP","54","80  >  49159 [ACK] Seq=35537 Ack=1990 Win=132096 Len=0"
"203","45.848712","204.79.197.200","172.16.4.193","TCP","54","80  >  49159 [ACK] Seq=35537 Ack=2327 Win=131584 Len=0"
"204","45.848870","204.79.197.200","172.16.4.193","TCP","54","80  >  49161 [ACK] Seq=1 Ack=1219 Win=132096 Len=0"
"205","45.849072","204.79.197.200","172.16.4.193","TCP","1375","80  >  49161 [ACK] Seq=1 Ack=1219 Win=132096 Len=1321 [TCP PDU reassembled in 220]"
"206","45.849251","204.79.197.200","172.16.4.193","TCP","1375","80  >  49161 [ACK] Seq=1322 Ack=1219 Win=132096 Len=1321 [TCP PDU reassembled in 220]"
"207","45.849321","172.16.4.193","204.79.197.200","TCP","60","49161  >  80 [ACK] Seq=1219 Ack=1322 Win=66048 Len=0"
"208","45.849364","204.79.197.200","172.16.4.193","TCP","1375","80  >  49161 [ACK] Seq=2643 Ack=1219 Win=132096 Len=1321 [TCP PDU reassembled in 220]"
"209","45.849481","204.79.197.200","172.16.4.193","TCP","1375","80  >  49161 [ACK] Seq=3964 Ack=1219 Win=132096 Len=1321 [TCP PDU reassembled in 220]"
"210","45.849566","172.16.4.193","204.79.197.200","TCP","60","49161  >  80 [ACK] Seq=1219 Ack=2643 Win=66048 Len=0"
"211","45.849584","172.16.4.193","204.79.197.200","TCP","60","49161  >  80 [ACK] Seq=1219 Ack=3964 Win=66048 Len=0"
"212","45.849658","204.79.197.200","172.16.4.193","TCP","1375","80  >  49161 [ACK] Seq=5285 Ack=1219 Win=132096 Len=1321 [TCP PDU reassembled in 220]"
"213","45.849738","204.79.197.200","172.16.4.193","TCP","1375","80  >  49161 [ACK] Seq=6606 Ack=1219 Win=132096 Len=1321 [TCP PDU reassembled in 220]"
"214","45.849817","172.16.4.193","204.79.197.200","TCP","60","49161  >  80 [ACK] Seq=1219 Ack=5285 Win=66048 Len=0"
"215","45.849848","204.79.197.200","172.16.4.193","TCP","1375","80  >  49161 [ACK] Seq=7927 Ack=1219 Win=132096 Len=1321 [TCP PDU reassembled in 220]"
"216","45.849955","204.79.197.200","172.16.4.193","TCP","1375","80  >  49161 [ACK] Seq=9248 Ack=1219 Win=132096 Len=1321 [TCP PDU reassembled in 220]"
"217","45.850067","172.16.4.193","204.79.197.200","TCP","60","49161  >  80 [ACK] Seq=1219 Ack=6606 Win=66048 Len=0"
"218","45.850075","204.79.197.200","172.16.4.193","TCP","1375","80  >  49161 [ACK] Seq=10569 Ack=1219 Win=132096 Len=1321 [TCP PDU reassembled in 220]"
"219","45.850076","172.16.4.193","204.79.197.200","TCP","60","49161  >  80 [ACK] Seq=1219 Ack=7927 Win=66048 Len=0"
"220","45.850103","204.79.197.200","172.16.4.193","HTTP","415","HTTP/1.1 200 OK  (application/x-javascript)"
"221","45.850316","172.16.4.193","204.79.197.200","TCP","60","49161  >  80 [ACK] Seq=1219 Ack=9248 Win=66048 Len=0"
"222","45.850328","172.16.4.193","204.79.197.200","TCP","60","49161  >  80 [ACK] Seq=1219 Ack=10569 Win=66048 Len=0"
"223","45.850336","172.16.4.193","204.79.197.200","TCP","60","49161  >  80 [ACK] Seq=1219 Ack=11890 Win=66048 Len=0"
"224","45.850566","172.16.4.193","204.79.197.200","TCP","60","49161  >  80 [ACK] Seq=1219 Ack=12251 Win=65536 Len=0"
"225","45.854665","204.79.197.200","172.16.4.193","HTTP","272","HTTP/1.1 204 OK "
"226","45.854812","172.16.4.193","204.79.197.200","TCP","60","49159  >  80 [ACK] Seq=2327 Ack=35755 Win=65792 Len=0"
"227","45.875215","172.16.4.193","204.79.197.200","HTTP","771","GET /rms/rms%20answers%20Rewards%20ReportActivityBootstrap/jc,nj/5d440020/4a4ee9e1.js HTTP/1.1 "
"228","45.875937","172.16.4.193","204.79.197.200","HTTP","943","GET /rms/Framework/jc,nj/749cc5d8/0e21f76a.js?bu=rms+answers+BoxModel+config.instant%2ccore%2ccore%24viewport%2ccore%24layout%2ccore%24metrics%2cmodules%24mutation%2cmodules%24error%2cmodules%24network%2cmodules%24cursor%2cmodules%24keyboard%2cmodules%24bot HTTP/1.1 "
"229","45.886108","172.16.4.193","204.79.197.200","TCP","825","49160  >  80 [PSH, ACK] Seq=1 Ack=1 Win=66048 Len=771 [TCP PDU reassembled in 230]"
"230","45.886308","172.16.4.193","204.79.197.200","HTTP","60","POST /rewardsapp/ncheader?ver=8_1_2_6162224&IID=SERP.5060&IG=194EC908DA65455B9E9A98285A33132B HTTP/1.1  (application/x-www-form-urlencoded)"
"231","45.948463","204.79.197.200","172.16.4.193","TCP","54","80  >  49159 [ACK] Seq=35755 Ack=3044 Win=130816 Len=0"
"232","45.948572","204.79.197.200","172.16.4.193","HTTP","729","HTTP/1.1 200 OK  (application/x-javascript)"
"233","45.948726","172.16.4.193","204.79.197.200","TCP","60","49159  >  80 [ACK] Seq=3044 Ack=36430 Win=65024 Len=0"
"234","45.953299","172.16.4.193","204.79.197.200","TCP","764","49159  >  80 [PSH, ACK] Seq=3044 Ack=36430 Win=65024 Len=710 [TCP PDU reassembled in 258]"
"235","45.953752","204.79.197.200","172.16.4.193","TCP","54","80  >  49161 [ACK] Seq=12251 Ack=2108 Win=131072 Len=0"
"236","45.954147","204.79.197.200","172.16.4.193","TCP","1375","80  >  49161 [ACK] Seq=12251 Ack=2108 Win=131072 Len=1321 [TCP PDU reassembled in 256]"
"237","45.954274","204.79.197.200","172.16.4.193","TCP","1375","80  >  49161 [ACK] Seq=13572 Ack=2108 Win=131072 Len=1321 [TCP PDU reassembled in 256]"
"238","45.954386","204.79.197.200","172.16.4.193","TCP","1375","80  >  49161 [ACK] Seq=14893 Ack=2108 Win=131072 Len=1321 [TCP PDU reassembled in 256]"
"239","45.954396","172.16.4.193","204.79.197.200","TCP","60","49161  >  80 [ACK] Seq=2108 Ack=13572 Win=66048 Len=0"
"240","45.954645","172.16.4.193","204.79.197.200","TCP","60","49161  >  80 [ACK] Seq=2108 Ack=14893 Win=66048 Len=0"
"241","45.954657","172.16.4.193","204.79.197.200","TCP","60","49161  >  80 [ACK] Seq=2108 Ack=16214 Win=66048 Len=0"
"242","45.954793","204.79.197.200","172.16.4.193","TCP","1375","80  >  49161 [ACK] Seq=16214 Ack=2108 Win=131072 Len=1321 [TCP PDU reassembled in 256]"
"243","45.954911","204.79.197.200","172.16.4.193","TCP","1375","80  >  49161 [ACK] Seq=17535 Ack=2108 Win=131072 Len=1321 [TCP PDU reassembled in 256]"
"244","45.955009","172.16.4.193","204.79.197.200","TCP","60","49161  >  80 [ACK] Seq=2108 Ack=17535 Win=66048 Len=0"
"245","45.955018","172.16.4.193","204.79.197.200","TCP","60","49161  >  80 [FIN, ACK] Seq=2108 Ack=17535 Win=66048 Len=0"
"246","45.955029","204.79.197.200","172.16.4.193","TCP","1375","80  >  49161 [ACK] Seq=18856 Ack=2108 Win=131072 Len=1321 [TCP PDU reassembled in 256]"
"247","45.955135","204.79.197.200","172.16.4.193","TCP","1375","80  >  49161 [ACK] Seq=20177 Ack=2108 Win=131072 Len=1321 [TCP PDU reassembled in 256]"
"248","45.955253","204.79.197.200","172.16.4.193","TCP","1375","80  >  49161 [ACK] Seq=21498 Ack=2108 Win=131072 Len=1321 [TCP PDU reassembled in 256]"
"249","45.955259","172.16.4.193","204.79.197.200","TCP","60","49161  >  80 [RST, ACK] Seq=2109 Ack=18856 Win=0 Len=0"
"250","45.955373","204.79.197.200","172.16.4.193","TCP","1375","80  >  49161 [ACK] Seq=22819 Ack=2108 Win=131072 Len=1321 [TCP PDU reassembled in 256]"
"251","45.955499","204.79.197.200","172.16.4.193","TCP","1375","80  >  49161 [ACK] Seq=24140 Ack=2108 Win=131072 Len=1321 [TCP PDU reassembled in 256]"
"252","45.955615","204.79.197.200","172.16.4.193","TCP","1375","80  >  49161 [ACK] Seq=25461 Ack=2108 Win=131072 Len=1321 [TCP PDU reassembled in 256]"
"253","45.955729","204.79.197.200","172.16.4.193","TCP","1375","80  >  49161 [ACK] Seq=26782 Ack=2108 Win=131072 Len=1321 [TCP PDU reassembled in 256]"
"254","45.955844","204.79.197.200","172.16.4.193","TCP","1375","80  >  49161 [ACK] Seq=28103 Ack=2108 Win=131072 Len=1321 [TCP PDU reassembled in 256]"
"255","45.955981","204.79.197.200","172.16.4.193","TCP","1375","80  >  49161 [ACK] Seq=29424 Ack=2108 Win=131072 Len=1321 [TCP PDU reassembled in 256]"
"256","45.956006","204.79.197.200","172.16.4.193","HTTP","400","HTTP/1.1 200 OK  (application/x-javascript)"
"257","45.957778","172.16.4.193","204.79.197.200","TCP","66","49162  >  80 [SYN] Seq=0 Win=8192 Len=0 MSS=1460 WS=256 SACK_PERM"
"258","45.958021","172.16.4.193","204.79.197.200","HTTP","86","POST /rewardsapp/reportActivity HTTP/1.1  (application/x-www-form-urlencoded)"
"259","45.962277","204.79.197.200","172.16.4.193","TCP","54","80  >  49160 [ACK] Seq=1 Ack=772 Win=132096 Len=0"
"260","45.962303","204.79.197.200","172.16.4.193","TCP","54","80  >  49160 [ACK] Seq=1 Ack=776 Win=132096 Len=0"
"261","45.985158","204.79.197.200","172.16.4.193","HTTP","629","HTTP/1.1 200 OK  (text/html)"
"262","45.985345","172.16.4.193","204.79.197.200","TCP","60","49160  >  80 [ACK] Seq=776 Ack=576 Win=65280 Len=0"
"263","45.985590","172.16.4.193","204.79.197.200","HTTP","987","GET /rms/Framework/jc,nj/749cc5d8/0e21f76a.js?bu=rms+answers+BoxModel+config.instant%2ccore%2ccore%24viewport%2ccore%24layout%2ccore%24metrics%2cmodules%24mutation%2cmodules%24error%2cmodules%24network%2cmodules%24cursor%2cmodules%24keyboard%2cmodules%24bot HTTP/1.1 "
"264","46.033552","204.79.197.200","172.16.4.193","TCP","54","80  >  49161 [ACK] Seq=31091 Ack=2109 Win=131072 Len=0"
"265","46.033585","204.79.197.200","172.16.4.193","TCP","54","80  >  49159 [ACK] Seq=36430 Ack=3754 Win=132096 Len=0"
"266","46.034320","204.79.197.200","172.16.4.193","TCP","66","80  >  49162 [SYN, ACK] Seq=0 Ack=1 Win=8192 Len=0 MSS=1321 WS=256 SACK_PERM"
"267","46.034351","204.79.197.200","172.16.4.193","TCP","54","80  >  49159 [ACK] Seq=36430 Ack=3786 Win=131840 Len=0"
"268","46.034442","172.16.4.193","204.79.197.200","TCP","60","49162  >  80 [ACK] Seq=1 Ack=1 Win=66048 Len=0"
"269","46.057726","204.79.197.200","172.16.4.193","TCP","54","80  >  49160 [ACK] Seq=576 Ack=1709 Win=131072 Len=0"
"270","46.058124","204.79.197.200","172.16.4.193","TCP","1375","80  >  49160 [ACK] Seq=576 Ack=1709 Win=131072 Len=1321 [TCP PDU reassembled in 286]"
"271","46.058372","172.16.4.193","204.79.197.200","TCP","60","49160  >  80 [ACK] Seq=1709 Ack=1897 Win=66048 Len=0"
"272","46.058519","204.79.197.200","172.16.4.193","TCP","1375","80  >  49160 [ACK] Seq=1897 Ack=1709 Win=131072 Len=1321 [TCP PDU reassembled in 286]"
"273","46.058615","204.79.197.200","172.16.4.193","TCP","1375","80  >  49160 [ACK] Seq=3218 Ack=1709 Win=131072 Len=1321 [TCP PDU reassembled in 286]"
"274","46.058721","204.79.197.200","172.16.4.193","TCP","1375","80  >  49160 [ACK] Seq=4539 Ack=1709 Win=131072 Len=1321 [TCP PDU reassembled in 286]"
"275","46.058755","172.16.4.193","204.79.197.200","TCP","60","49160  >  80 [ACK] Seq=1709 Ack=3218 Win=66048 Len=0"
"276","46.058832","204.79.197.200","172.16.4.193","TCP","1375","80  >  49160 [ACK] Seq=5860 Ack=1709 Win=131072 Len=1321 [TCP PDU reassembled in 286]"
"277","46.058953","204.79.197.200","172.16.4.193","TCP","1375","80  >  49160 [ACK] Seq=7181 Ack=1709 Win=131072 Len=1321 [TCP PDU reassembled in 286]"
"278","46.059005","172.16.4.193","204.79.197.200","TCP","60","49160  >  80 [ACK] Seq=1709 Ack=4539 Win=66048 Len=0"
"279","46.059018","172.16.4.193","204.79.197.200","TCP","60","49160  >  80 [ACK] Seq=1709 Ack=5860 Win=66048 Len=0"
"280","46.059087","204.79.197.200","172.16.4.193","TCP","1375","80  >  49160 [ACK] Seq=8502 Ack=1709 Win=131072 Len=1321 [TCP PDU reassembled in 286]"
"281","46.059199","204.79.197.200","172.16.4.193","TCP","1375","80  >  49160 [ACK] Seq=9823 Ack=1709 Win=131072 Len=1321 [TCP PDU reassembled in 286]"
"282","46.059255","172.16.4.193","204.79.197.200","TCP","60","49160  >  80 [ACK] Seq=1709 Ack=7181 Win=66048 Len=0"
"283","46.059268","172.16.4.193","204.79.197.200","TCP","60","49160  >  80 [ACK] Seq=1709 Ack=8502 Win=66048 Len=0"
"284","46.059311","204.79.197.200","172.16.4.193","TCP","1375","80  >  49160 [ACK] Seq=11144 Ack=1709 Win=131072 Len=1321 [TCP PDU reassembled in 286]"
"285","46.059444","204.79.197.200","172.16.4.193","TCP","1375","80  >  49160 [ACK] Seq=12465 Ack=1709 Win=131072 Len=1321 [TCP PDU reassembled in 286]"
"286","46.059472","204.79.197.200","172.16.4.193","HTTP","745","HTTP/1.1 206 Partial Content  (application/x-javascript)"
"287","46.059505","172.16.4.193","204.79.197.200","TCP","60","49160  >  80 [ACK] Seq=1709 Ack=9823 Win=66048 Len=0"
"288","46.059520","172.16.4.193","204.79.197.200","TCP","60","49160  >  80 [ACK] Seq=1709 Ack=11144 Win=64512 Len=0"
"289","46.059528","172.16.4.193","204.79.197.200","TCP","60","49160  >  80 [ACK] Seq=1709 Ack=12465 Win=63232 Len=0"
"290","46.059755","172.16.4.193","204.79.197.200","TCP","60","[TCP Window Update] 49160  >  80 [ACK] Seq=1709 Ack=12465 Win=66048 Len=0"
"291","46.059766","172.16.4.193","204.79.197.200","TCP","60","49160  >  80 [ACK] Seq=1709 Ack=13786 Win=66048 Len=0"
"292","46.059774","172.16.4.193","204.79.197.200","TCP","60","49160  >  80 [ACK] Seq=1709 Ack=14477 Win=65280 Len=0"
"293","46.066384","172.16.4.193","204.79.197.200","HTTP","749","GET /az/hprichbg/rb/VillersAbbey_EN-US10350783163_1920x1080.jpg HTTP/1.1 "
"294","46.066590","204.79.197.200","172.16.4.193","HTTP","747","HTTP/1.1 200 OK  (application/x-javascript)"
"295","46.066778","172.16.4.193","204.79.197.200","TCP","60","49159  >  80 [ACK] Seq=3786 Ack=37123 Win=66048 Len=0"
"296","46.100648","172.16.4.193","204.79.197.200","HTTP","715","GET /sa/8_1_2_6162224/HPImgVidViewer_c.js HTTP/1.1 "
"297","46.121271","204.79.197.200","172.16.4.193","HTTP/XML","1246","HTTP/1.1 200 OK "
"298","46.121478","172.16.4.193","204.79.197.200","TCP","60","49158  >  80 [ACK] Seq=1186 Ack=9414 Win=64768 Len=0"
"299","46.126499","172.16.4.193","204.79.197.200","HTTP","624","GET /sa/simg/bing_p_rr_teal_min.ico HTTP/1.1 "
"300","46.142797","204.79.197.200","172.16.4.193","TCP","54","80  >  49160 [ACK] Seq=14477 Ack=2404 Win=132096 Len=0"
"301","46.143154","204.79.197.200","172.16.4.193","TCP","1375","80  >  49160 [ACK] Seq=14477 Ack=2404 Win=132096 Len=1321 [TCP PDU reassembled in 863]"
"302","46.143264","204.79.197.200","172.16.4.193","TCP","1375","80  >  49160 [ACK] Seq=15798 Ack=2404 Win=132096 Len=1321 [TCP PDU reassembled in 863]"
"303","46.143394","204.79.197.200","172.16.4.193","TCP","1375","80  >  49160 [ACK] Seq=17119 Ack=2404 Win=132096 Len=1321 [TCP PDU reassembled in 863]"
"304","46.143409","172.16.4.193","204.79.197.200","TCP","60","49160  >  80 [ACK] Seq=2404 Ack=15798 Win=66048 Len=0"
"305","46.143656","172.16.4.193","204.79.197.200","TCP","60","49160  >  80 [ACK] Seq=2404 Ack=17119 Win=66048 Len=0"
"306","46.143669","172.16.4.193","204.79.197.200","TCP","60","49160  >  80 [ACK] Seq=2404 Ack=18440 Win=66048 Len=0"
"307","46.143722","204.79.197.200","172.16.4.193","TCP","1375","80  >  49160 [ACK] Seq=18440 Ack=2404 Win=132096 Len=1321 [TCP PDU reassembled in 863]"
"308","46.143845","204.79.197.200","172.16.4.193","TCP","1375","80  >  49160 [ACK] Seq=19761 Ack=2404 Win=132096 Len=1321 [TCP PDU reassembled in 863]"
"309","46.143932","172.16.4.193","204.79.197.200","TCP","60","49160  >  80 [ACK] Seq=2404 Ack=19761 Win=66048 Len=0"
"310","46.143954","204.79.197.200","172.16.4.193","TCP","1375","80  >  49160 [ACK] Seq=21082 Ack=2404 Win=132096 Len=1321 [TCP PDU reassembled in 863]"
"311","46.144067","204.79.197.200","172.16.4.193","TCP","1375","80  >  49160 [ACK] Seq=22403 Ack=2404 Win=132096 Len=1321 [TCP PDU reassembled in 863]"
"312","46.144179","204.79.197.200","172.16.4.193","TCP","1375","80  >  49160 [ACK] Seq=23724 Ack=2404 Win=132096 Len=1321 [TCP PDU reassembled in 863]"
"313","46.144182","172.16.4.193","204.79.197.200","TCP","60","49160  >  80 [ACK] Seq=2404 Ack=21082 Win=66048 Len=0"
"314","46.144195","172.16.4.193","204.79.197.200","TCP","60","49160  >  80 [ACK] Seq=2404 Ack=22403 Win=66048 Len=0"
"315","46.144290","204.79.197.200","172.16.4.193","TCP","1375","80  >  49160 [ACK] Seq=25045 Ack=2404 Win=132096 Len=1321 [TCP PDU reassembled in 863]"
"316","46.144427","204.79.197.200","172.16.4.193","TCP","1375","80  >  49160 [ACK] Seq=26366 Ack=2404 Win=132096 Len=1321 [TCP PDU reassembled in 863]"
"317","46.144432","172.16.4.193","204.79.197.200","TCP","60","49160  >  80 [ACK] Seq=2404 Ack=23724 Win=66048 Len=0"
"318","46.144447","172.16.4.193","204.79.197.200","TCP","60","49160  >  80 [ACK] Seq=2404 Ack=25045 Win=66048 Len=0"
"319","46.144538","204.79.197.200","172.16.4.193","TCP","1375","80  >  49160 [ACK] Seq=27687 Ack=2404 Win=132096 Len=1321 [TCP PDU reassembled in 863]"
"320","46.144657","204.79.197.200","172.16.4.193","TCP","1375","80  >  49160 [ACK] Seq=29008 Ack=2404 Win=132096 Len=1321 [TCP PDU reassembled in 863]"
"321","46.144684","172.16.4.193","204.79.197.200","TCP","60","49160  >  80 [ACK] Seq=2404 Ack=26366 Win=66048 Len=0"
"322","46.144698","172.16.4.193","204.79.197.200","TCP","60","49160  >  80 [ACK] Seq=2404 Ack=27687 Win=66048 Len=0"
